openAlex_id,doi,title,publication_year,asset_id,has_assetId
https://openalex.org/W2808759494,https://doi.org/10.1177/1742395318782377,Biopsychosocial benefits of movement-based complementary and integrative health therapies for patients with chronic conditions,2018,,False
https://openalex.org/W2904931847,https://doi.org/10.1093/geront/gny165,In the Eyes of Those Who Were Randomized: Perceptions of Disadvantaged Older Adults in a Tai Chi Trial,2018,9923957833801921,True
https://openalex.org/W3037964428,https://doi.org/10.1021/acsomega.0c02019,Enzyme-Instructed Self-Assembly for Subcellular Targeting,2020,,False
https://openalex.org/W3035946751,https://doi.org/10.1093/mnras/staa2687,μ⋆ masses: weak-lensing calibration of the Dark Energy Survey Year 1 redMaPPer clusters using stellar masses,2020,,False
https://openalex.org/W3044620228,https://doi.org/10.1016/j.aim.2020.107304,Lagrangian fibers of Gelfand-Cetlin systems,2020,,False
https://openalex.org/W3026267845,https://doi.org/10.1016/j.jsat.2020.108040,Outpatient care for opioid use disorder among the commercially insured: Use of medication and psychosocial treatment,2020,9924086409401921,True
https://openalex.org/W2783576542,https://doi.org/10.1093/scan/nsx144,Aging is associated with a prefrontal lateral-medial shift during picture-induced negative affect,2018,9924086302701921,True
https://openalex.org/W2804039081,https://doi.org/10.1152/jn.00044.2018,Neural architecture: from cells to circuits,2018,9924028610101921,True
https://openalex.org/W2792166641,https://doi.org/10.1016/j.jqsrt.2018.02.013,VUV pressure-broadening in sulfur dioxide,2018,,False
https://openalex.org/W2947313069,https://doi.org/10.1016/j.apmr.2019.04.015,The Rehabilitation Enhancing Aging Through Connected Health Prehabilitation Trial,2019,9924086414201921,True
https://openalex.org/W2909394516,https://doi.org/10.3389/fncel.2018.00514,Improvements in Simultaneous Sodium and Calcium Imaging,2019,,False
https://openalex.org/W2983701606,https://doi.org/10.1021/acs.jmedchem.9b01210,Structure–Activity Relationship of Peptide-Conjugated Chloramphenicol for Inhibiting <i>Escherichia coli</i>,2019,,False
https://openalex.org/W2891805386,https://doi.org/10.1007/s00213-018-5009-2,"Serotonin transporter gene (5-HTT) rs6354 polymorphism, job-related stress, and their interaction in burnout in healthcare workers in a Chinese hospital",2018,,False
https://openalex.org/W2964755287,https://doi.org/10.1016/j.aim.2019.106743,"Bounded orbits of diagonalizable flows on finite volume quotients of products of <mml:math xmlns:mml=""http://www.w3.org/1998/Math/MathML"" altimg=""si1.svg""><mml:msub><mml:mrow><mml:mi mathvariant=""normal"">SL</mml:mi></mml:mrow><mml:mrow><mml:mn>2</mml:mn></mml:mrow></mml:msub><mml:mo stretchy=""false"">(</mml:mo><mml:mi mathvariant=""double-struck"">R</mml:mi><mml:mo stretchy=""false"">)</mml:mo></mml:math>",2019,,False
https://openalex.org/W2985814660,https://doi.org/10.1016/j.apcata.2019.117330,Analysis of coke formed during zeolite-catalyzed supercritical dodecane cracking: Effect of supercritical water,2019,9924086659901921,True
https://openalex.org/W2795035105,https://doi.org/10.1016/j.jmb.2018.03.014,Some Surprising Implications of NMR-directed Simulations of Substrate Recognition and Binding by Cytochrome P450 cam (CYP101A1),2018,9924086129101921,True
https://openalex.org/W3132533460,https://doi.org/10.1242/jcs.258500,Modified chromosome structure caused by phosphomimetic H2A modulates the DNA damage response by increasing chromatin mobility in yeast,2021,9923970127401921,True
https://openalex.org/W3068449846,https://doi.org/10.1016/j.aim.2020.107370,Plethystic formulas for permutation enumeration,2020,,False
https://openalex.org/W3047428758,https://doi.org/10.1177/1363459320946474,Beyond the hour of death: Family experiences of grief and bereavement following an end-of-life hospitalization in the intensive care unit,2020,,False
https://openalex.org/W3007489633,https://doi.org/10.1021/acs.jafc.9b06037,"Formation of Char-Like, Fused-Ring Aromatic Structures from a Nonpyrogenic Pathway during Decomposition of Wheat Straw",2020,9924126818701921,True
https://openalex.org/W3004119995,https://doi.org/10.1093/mnras/staa1452,"DES16C3cje: A low-luminosity, long-lived supernova",2020,,False
https://openalex.org/W2802137655,https://doi.org/10.1021/acs.inorgchem.8b00280,Probing Fe–V Bonding in a<i>C</i><sub>3</sub>-Symmetric Heterobimetallic Complex,2018,,False
https://openalex.org/W2998697071,https://doi.org/10.1080/13668803.2019.1704398,How much would family and medical leave cost workers in the US? Racial/ethnic variation in economic hardship under unpaid and paid policies,2019,9924023335301921,True
https://openalex.org/W3156115256,https://doi.org/10.1126/science.abf0922,Comment on “Circadian rhythms in the absence of the clock gene <i>Bmal1</i> ”,2021,,False
https://openalex.org/W3186798793,https://doi.org/10.1016/j.jecp.2021.105235,Disentangling language status and country-of-origin explanations of the bilingual advantage in preschoolers,2021,,False
https://openalex.org/W2786773105,https://doi.org/10.1021/acs.biochem.7b01272,Molecular Interactions between a Fluoride Ion Channel and Synthetic Protein Blockers,2018,9924086300101921,True
https://openalex.org/W3082497967,https://doi.org/10.1111/jcpp.13312,Classifying childhood war trauma exposure: latent profile analyses of Sierra Leone’s former child soldiers,2020,,False
https://openalex.org/W2940303838,https://doi.org/10.1073/pnas.1900615116,Conformational switching of chiral colloidal rafts regulates raft–raft attractions and repulsions,2019,9924086410101921,True
https://openalex.org/W3012069718,https://doi.org/10.1021/acs.inorgchem.9b03790,A Series of Dimeric Cobalt Complexes Bridged by N-Heterocyclic Phosphido Ligands,2020,9923989469001921,True
https://openalex.org/W3161131605,https://doi.org/10.7554/elife.65766,Perturbation of amygdala-cortical projections reduces ensemble coherence of palatability coding in gustatory cortex,2021,9924144209301921,True
https://openalex.org/W3207163980,https://doi.org/10.1371/journal.pone.0258321,Efficient spline regression for neural spiking data,2021,9924144209901921,True
https://openalex.org/W2891849816,https://doi.org/10.1093/mnras/stz2036,Dark Energy Survey Year 1 results: the effect of intracluster light on photometric redshifts for weak gravitational lensing,2019,,False
https://openalex.org/W3161432305,https://doi.org/10.1080/19439342.2021.1924833,The effect of gender targeting of food transfers on child nutritional status: experimental evidence from the Bolivian amazon,2021,9924087084301921,True
https://openalex.org/W2910317450,https://doi.org/10.1021/acs.jpca.8b10819,Modulation of Turing Patterns in the CDIMA Reaction by Ultraviolet and Visible Light,2019,9923972821601921,True
https://openalex.org/W2978413996,https://doi.org/10.1007/s00605-020-01498-1,Khintchine-type theorems for values of subhomogeneous functions at integer points,2021,9924117683701921,True
https://openalex.org/W2891280595,https://doi.org/10.1016/j.jsat.2018.09.002,Incentives in a public addiction treatment system: Effects on waiting time and selection,2018,9923958110801921,True
https://openalex.org/W3137170874,https://doi.org/10.1080/08897077.2021.1900986,"Medical Marijuana Laws (MMLs) and Dispensary Provisions not Associated with Higher Odds of Adolescent Marijuana or Heavy Marijuana Use: A 46 State Analysis, 1991–2015",2021,,False
https://openalex.org/W2803404430,https://doi.org/10.1523/eneuro.0455-17.2018,dSTIM- and Ral/Exocyst-Mediated Synaptic Release from Pupal Dopaminergic Neurons Sustains<i>Drosophila</i>Flight,2018,,False
https://openalex.org/W3106943507,https://doi.org/10.1080/09658211.2020.1849307,Evaluating heart rate variability as a predictor of the influence of lying on memory,2020,9924086555701921,True
https://openalex.org/W2938520875,https://doi.org/10.1103/physrevlett.125.018002,Force-Induced Formation of Twisted Chiral Ribbons,2020,,False
https://openalex.org/W2903545774,https://doi.org/10.1016/j.bmcl.2018.11.055,Diarylcarbonates are a new class of deubiquitinating enzyme inhibitor,2018,9923972795301921,True
https://openalex.org/W2891390274,https://doi.org/10.1063/1.5011766,Complex spatiotemporal behavior and coherent excitations in critically-coupled chains of neural circuits,2018,,False
https://openalex.org/W2623297497,https://doi.org/10.1007/s11040-018-9265-5,Lozenge Tilings of Hexagons with Cuts and Asymptotic Fluctuations: a New Universality Class,2018,9924117690101921,True
https://openalex.org/W4213239797,https://doi.org/10.3758/s13415-022-00985-2,Neuroanatomical Correlates of Perceived Stress Controllability in Adolescents and Emerging Adults,2022,9924103895301921,True
https://openalex.org/W4207038681,https://doi.org/10.1063/5.0080839,Evolution of plasmon-like excited states in silver nanowires and nanorods,2022,9924087081501921,True
https://openalex.org/W2789282835,https://doi.org/10.1016/j.jcta.2023.105802,Trianguloids and triangulations of root polytopes,2023,,False
https://openalex.org/W2808385779,https://doi.org/10.1093/mnras/sty1537,Compact Groups analysis using weak gravitational lensing II: CFHT Stripe 82 data,2018,,False
https://openalex.org/W4291708512,https://doi.org/10.1007/s11121-022-01400-5,Economic Evaluation Design within the HEAL Prevention Cooperative,2022,9924159476101921,True
https://openalex.org/W2947410894,https://doi.org/10.1021/acsabm.9b00243,Silk-Like Protein with Persistent Radicals Identified in Oyster Adhesive by Solid-State NMR,2019,9924126818601921,True
https://openalex.org/W2804803082,https://doi.org/10.1016/j.ridd.2018.04.025,"The influence of early intervention, informal support and the family environment on trajectories of competence for fathers raising children with developmental disabilities",2018,9924014405401921,True
https://openalex.org/W2950379157,https://doi.org/10.1016/j.dhjo.2019.06.001,"Do disability, parenthood, and gender matter for health disparities?: A US population-based study",2019,9924014273501921,True
https://openalex.org/W2783329807,https://doi.org/10.1016/j.jsat.2018.01.006,Employment after beginning treatment for substance use disorders: The impact of race/ethnicity and client community of residence,2018,9924023479101921,True
https://openalex.org/W3132542794,https://doi.org/10.1021/acs.bioconjchem.1c00032,Peptide Assemblies Mimicking Chaperones for Protein Trafficking,2021,9924537531401921,True
https://openalex.org/W2795670432,https://doi.org/10.1063/1.5021585,Pulse-coupled Belousov-Zhabotinsky oscillators with frequency modulation,2018,9923972931801921,True
https://openalex.org/W2900047811,https://doi.org/10.1109/tbme.2018.2880575,Noninvasive Seizure Localization With Single-Photon Emission Computed Tomography Is Impacted by Preictal/Early Ictal Network Dynamics,2018,,False
https://openalex.org/W3037409061,https://doi.org/10.1080/01419870.2020.1776362,"<i>Harmony of the Seas?</i>: Work, faith, and religious difference among multinational migrant workers on board cargo ships",2020,9924086294001921,True
https://openalex.org/W2969513046,https://doi.org/10.1016/j.chiabu.2019.104097,Childhood maltreatment experiences and problematic sexual outcomes in adult males who have sexually offended: Further evidence of the potency of male caregiver psychological abuse,2019,,False
https://openalex.org/W2996546145,https://doi.org/10.1039/c9dt04544a,"Synthesis, characterization, DFT calculations, and reactivity study of a nitrido-bridged dimeric vanadium(<scp>iv</scp>) complex",2019,,False
https://openalex.org/W3013272684,https://doi.org/10.1093/mnras/staa1803,Dark Energy Survey identification of a low-mass active galactic nucleus at redshift 0.823 from optical variability,2020,,False
https://openalex.org/W2895929999,https://doi.org/10.1177/1073191118804878,A Reformulated Architecture of Cognitive Risks for Psychopathology: Common and Specific Dimensions and Links to Internalizing Outcomes in Adolescence,2018,9924086437501921,True
https://openalex.org/W2412762869,https://doi.org/10.1021/acs.biochem.8b01252,Structures of Class Id Ribonucleotide Reductase Catalytic Subunits Reveal a Minimal Architecture for Deoxynucleotide Biosynthesis,2019,9923989192901921,True
https://openalex.org/W2974554230,https://doi.org/10.1111/mmi.14393,Horizontal transfer of a pathway for coumarate catabolism unexpectedly inhibits purine nucleotide biosynthesis,2019,9923972816801921,True
https://openalex.org/W3164744674,https://doi.org/10.1080/2194587x.2021.1898981,How Do Colleges and Universities Support Multifaith Chaplaincy? The Causes and Effects of Different Institutional Approaches,2021,9924086407301921,True
https://openalex.org/W3132825877,https://doi.org/10.1016/j.neurobiolaging.2021.02.009,An ERP investigation of age differences in the negativity bias for self-relevant and non–self-relevant stimuli,2021,9924086366601921,True
https://openalex.org/W3109336826,https://doi.org/10.1016/j.cct.2020.106236,Targeting self-control as a behavior change mechanism to increase physical activity: Study protocol of a randomized controlled trial,2020,9924086778101921,True
https://openalex.org/W3009361348,https://doi.org/10.1002/cssc.201903446,Rapid Depolymerization of Decrystallized Cellulose to Soluble Products via Ethanolysis under Mild Conditions,2020,9924086669701921,True
https://openalex.org/W3119538062,https://doi.org/10.1007/s10597-020-00750-0,Prevalence and Predictors of Limited Literacy in Public Mental Health Care,2021,9924159784001921,True
https://openalex.org/W3003292095,https://doi.org/10.1093/mnras/staa200,Observation and confirmation of nine strong-lensing systems in Dark Energy Survey Year 1 data,2020,,False
https://openalex.org/W3169744936,https://doi.org/10.1007/s12397-021-09373-3,Lonely in Lockdown: Predictors of Emotional and Mental Health Difficulties Among Jewish Young Adults during the COVID-19 Pandemic,2021,9924084986501921,True
https://openalex.org/W3116158643,https://doi.org/10.3390/molecules26010077,Heterotypic Supramolecular Hydrogels Formed by Noncovalent Interactions in Inflammasomes,2020,9924393182401921,True
https://openalex.org/W2893641430,https://doi.org/10.1103/physrevd.99.106010,Scrambling in two-dimensional conformal field theories with light and smeared operators,2019,,False
https://openalex.org/W3101891115,https://doi.org/10.1177/0950017020952662,On the Biopsychosocial Costs of Alienated Labor,2020,9924086646101921,True
https://openalex.org/W4220876786,https://doi.org/10.1093/milmed/usac074,Dose of Exercise Therapy Among Active Duty Soldiers With Chronic Pain Is Associated With Lower Risk of Long-Term Adverse Outcomes After Linking to the Veterans Health Administration,2022,9924147765701921,True
https://openalex.org/W2936682055,https://doi.org/10.1002/cbic.201900168,Dynamic Continuum of Molecular Assemblies for Controlling Cell Fates,2019,9924537532801921,True
https://openalex.org/W2929391723,https://doi.org/10.1152/jn.00607.2018,Adaptation to Coriolis force perturbations of postural sway requires an asymmetric two-leg model,2019,9924086609401921,True
https://openalex.org/W4281671486,https://doi.org/10.1103/physrevb.105.205140,Emergent space-time supersymmetry at disordered quantum critical points,2022,,False
https://openalex.org/W2792650885,https://doi.org/10.1021/acs.biochem.8b00142,Dynamic Characteristics of Guanosine-5′-monophosphate Reductase Complexes Revealed by High-Resolution <sup>31</sup>P Field-Cycling NMR Relaxometry,2018,9923973088401921,True
https://openalex.org/W3040838971,https://doi.org/10.1186/s12960-020-00483-x,Global Fund financing and human resources for health investments in the Eastern Mediterranean Region,2020,9924031171701921,True
https://openalex.org/W2796089177,https://doi.org/10.1177/0269881118758303,Dietary dopamine depletion blunts reward network sensitivity to face trustworthiness,2018,9924057159501921,True
https://openalex.org/W3113782791,https://doi.org/10.1016/j.jval.2020.11.003,Real-World Evidence: Understanding Sources of Variability Through Empirical Analysis,2020,9924143224001921,True
https://openalex.org/W3213452111,https://doi.org/10.3390/suschem2040036,A New Method for Solid Acid Catalyst Evaluation for Cellulose Hydrolysis,2021,9924151769401921,True
https://openalex.org/W3165310186,https://doi.org/10.1016/j.drugalcdep.2021.108772,"Predictors of US states’ adoption of naloxone access laws, 2001–2017",2021,9924143221701921,True
https://openalex.org/W4226139022,https://doi.org/10.3389/fncel.2022.854315,Strong Aversive Conditioning Triggers a Long-Lasting Generalized Aversion,2022,9924140710901921,True
https://openalex.org/W2808185242,https://doi.org/10.1002/asia.201800875,Down‐regulating Proteolysis to Enhance Anticancer Activity of Peptide Nanofibers,2018,9924537533001921,True
https://openalex.org/W3033036528,https://doi.org/10.1016/j.ajem.2020.06.009,Critical procedure performance in pediatric patients: Results from a national emergency medicine group,2020,,False
https://openalex.org/W2989054918,https://doi.org/10.1016/j.drugalcdep.2019.107735,Is it feasible to pay specialty substance use disorder treatment programs based on patient outcomes?,2019,9924079408001921,True
https://openalex.org/W3112470649,https://doi.org/10.1080/19320248.2020.1855284,"Getting Food to the Table: Challenges, Strategies, and Compromises Experienced by Low-Income Veterans Raising Children",2020,,False
https://openalex.org/W3080877851,https://doi.org/10.7554/elife.60703,Theoretical musings,2020,9923970775101921,True
https://openalex.org/W3139150868,https://doi.org/10.1016/j.mrfmmm.2021.111742,"DNA damage-signaling, homologous recombination and genetic mutation induced by 5-azacytidine and DNA-protein crosslinks in Escherichia coli",2021,9923970131801921,True
https://openalex.org/W2963727788,https://doi.org/10.1093/imrn/rnz106,The <i>q</i>-Hahn PushTASEP,2019,,False
https://openalex.org/W3096916280,https://doi.org/10.1021/acs.biochem.0c00724,A Model for the Solution Structure of Human Fe(II)-Bound Acireductone Dioxygenase and Interactions with the Regulatory Domain of Matrix Metalloproteinase I (MMP-I),2020,9923972809401921,True
https://openalex.org/W3188516596,https://doi.org/10.1112/plms.12470,A measure estimate in geometry of numbers and improvements to Dirichlet's theorem,2022,,False
https://openalex.org/W3206219383,https://doi.org/10.1093/imrn/rnaa256,A Zero-One Law for Uniform Diophantine Approximation in Euclidean Norm,2020,,False
https://openalex.org/W3159595021,https://doi.org/10.1177/10442073211006394,"Barriers and Solutions to Passing State Legislation to Protect the Rights of Parents With Disabilities: Lessons From Interviews With Advocates, Attorneys, and Legislators",2021,,False
https://openalex.org/W4290874903,https://doi.org/10.1145/3534678.3542602,Toward Graph Minimally-Supervised Learning,2022,,False
https://openalex.org/W3155544093,https://doi.org/10.1371/journal.pone.0250039,"The prevalence, severity and chronicity of abuse towards older men: Insights from a multinational European survey",2021,,False
https://openalex.org/W4225287691,https://doi.org/10.1177/13623613221091319,Reasons for alcohol use and non-use by underage U.S. autistic youth: A qualitative study,2022,,False
https://openalex.org/W3196319394,https://doi.org/10.1177/10443894211023062,Employee Ownership: Structuring Opportunities for Racial Wealth Building and Family Well-Being,2021,9924035763901921,True
https://openalex.org/W4307181067,https://doi.org/10.1021/acsinfecdis.2c00442,Large-Scale Synthesis of Man<sub>9</sub>GlcNAc<sub>2</sub> High-Mannose Glycan and the Effect of the Glycan Core on Multivalent Recognition by HIV Antibody 2G12,2022,9924208985901921,True
https://openalex.org/W4313555015,https://doi.org/10.1063/5.0131305,"Symmetry-breaking rhythms in coupled, identical fast–slow oscillators",2023,9924188849901921,True
https://openalex.org/W4206612346,https://doi.org/10.1007/s12215-021-00691-x,Continuous quivers of type A (I) foundations,2022,9924148966201921,True
https://openalex.org/W4229049833,https://doi.org/10.1021/acs.biochem.2c00163,Domain Fusion of Two Oxygenases Affords Organophosphonate Degradation in Pathogenic Fungi,2022,9924113775401921,True
https://openalex.org/W3203544387,https://doi.org/10.1021/acsinfecdis.1c00342,The Enzymatic Activity of Inosine 5′-Monophosphate Dehydrogenase May Not Be a Vulnerable Target for <i>Staphylococcus aureus</i> Infections,2021,9924050701001921,True
https://openalex.org/W3212608583,https://doi.org/10.1016/j.jsat.2021.108664,Association of facility characteristics and substance use disorder outcomes at discharge from residential treatment,2021,9924144024601921,True
https://openalex.org/W4319061359,https://doi.org/10.1016/j.jinorgbio.2023.112129,Conformational heterogeneity suggests multiple substrate binding modes in CYP106A2,2023,9924198887101921,True
https://openalex.org/W4386917131,https://doi.org/10.3758/s13421-023-01459-7,Do cultural differences emerge at different levels of representational hierarchy?,2023,9924339971401921,True
https://openalex.org/W2811201120,https://doi.org/10.1016/j.dhjo.2018.06.002,Health care utilization among children with chronic conditions in military families,2018,9924014273301921,True
https://openalex.org/W2900266313,https://doi.org/10.1103/physrevb.100.134412,"Phase transitions in the Rényi entropies of a <mml:math xmlns:mml=""http://www.w3.org/1998/Math/MathML""><mml:mn>2</mml:mn><mml:mo>+</mml:mo><mml:mn>1</mml:mn><mml:mtext>D</mml:mtext></mml:math> large-<mml:math xmlns:mml=""http://www.w3.org/1998/Math/MathML""><mml:mi>N</mml:mi></mml:math> interacting vector model",2019,9924117865501921,True
https://openalex.org/W2953677287,https://doi.org/10.3390/nu11071538,Genetic Permissiveness and Dietary Glycemic Load Interact to Predict Type-II Diabetes in the Nile rat (Arvicanthis niloticus),2019,9923987240201921,True
https://openalex.org/W3082702886,https://doi.org/10.1080/00934690.2020.1808751,Integrating Multi-Scalar Sampling Strategies for Archaeological Sediment Chemistry,2020,,False
https://openalex.org/W3045668317,https://doi.org/10.1039/d0sm00867b,The ratio of hydrogelator to precursor controls the enzymatic hydrogelation of a branched peptide,2020,9924537531101921,True
https://openalex.org/W3016614369,https://doi.org/10.1021/acs.jpca.0c01087,Capillarity-Induced Propagation Reversal of Chemical Waves in a Self-oscillating Gel,2020,9923973083501921,True
https://openalex.org/W4389266072,https://doi.org/10.1016/j.jalgebra.2023.11.015,Hurwitz numbers for reflection groups II: Parabolic quasi-Coxeter elements,2023,9924340272301921,True
https://openalex.org/W3195115324,https://doi.org/10.1016/j.ssmqr.2021.100001,Encountering the social determinants of health on a COVID-19 ICU: Frontline providers’ perspectives on inequality in a time of pandemic,2021,9924131715501921,True
https://openalex.org/W4240044487,https://doi.org/10.1002/ange.201905230,Diglycine Enables Rapid Intrabacterial Hydrolysis for Activating Anbiotics against Gram‐negative Bacteria,2019,9924537534101921,True
https://openalex.org/W3208513668,https://doi.org/10.1145/3459637.3482465,RxNet,2021,9924140712501921,True
https://openalex.org/W3110844253,https://doi.org/10.1021/acs.jpcb.0c08422,Impact of PDMS-Based Microfluidics on Belousov–Zhabotinsky Chemical Oscillators,2020,9924125724901921,True
https://openalex.org/W4205835256,https://doi.org/10.1002/adsu.202100286,Mechanochemical Pretreatment for Waste‐Free Conversion of Bamboo to Simple Sugars: Utilization of Available Resources for Developing Economies,2022,9924151769301921,True
https://openalex.org/W3090294078,https://doi.org/10.1152/jn.00612.2019,Multiple roles of active stiffness in upright balance and multidirectional sway,2020,9924086510201921,True
https://openalex.org/W4225124948,https://doi.org/10.3389/fpubh.2022.747919,Strengthening Community Participation by People With Disabilities in Community-Based Group Homes Through Innovative Action Research,2022,9924112211801921,True
https://openalex.org/W4285819413,https://doi.org/10.1177/20499361221112171,"Comparison of clinical presentations and burden of respiratory syncytial virus in infants across three distinct healthcare settings in Davidson County, Tennessee",2022,9924154943801921,True
https://openalex.org/W3003732203,https://doi.org/10.1016/j.jsat.2020.01.019,Impact of recovery support navigators on continuity of care after detoxification,2020,9923958481801921,True
https://openalex.org/W4288049801,https://doi.org/10.1103/physreve.105.024310,Pattern formation in a four-ring reaction-diffusion network with heterogeneity,2022,9924144005701921,True
https://openalex.org/W3186388793,https://doi.org/10.1039/d1cp02761a,Hydride- and halide-substituted Au<sub>9</sub>(PH<sub>3</sub>)<sub>8</sub><sup>3+</sup> nanoclusters: similar absorption spectra disguise distinct geometries and electronic structures,2021,9924050516301921,True
https://openalex.org/W4295048758,https://doi.org/10.1021/acs.jpca.2c05782,Parametrization of the PM7 Semiempirical Quantum Mechanical Method for Silver Nanoclusters,2022,9924159294801921,True
https://openalex.org/W4292004650,https://doi.org/10.1093/geronb/gbac114,Intent-Based Moral Judgment in Old Age,2022,9924211579901921,True
https://openalex.org/W2987560501,https://doi.org/10.1021/acs.cgd.9b01267,Crystal Structures of Missing Links in the Early History of Solid-State Reactions: The Group IA Acrylates and Methacrylates,2019,9923989574701921,True
https://openalex.org/W4285302070,https://doi.org/10.1093/infdis/jiac164,Inequalities in Health Impact of Alternative Reimbursement Pathways for Nirsevimab in the United States,2022,9924159372501921,True
